{
	"upstream_emissions": {
		"software": 0,
		"employee_hardware": 0,
		"network_hardware": 0,
		"server_hardware": 0
	},
	"direct_emissions": {
		"onsite_employee_hardware": 0,
		"networking": 0,
		"servers": 0,
		"generators": 0
	},
	"indirect_emissions": {
		"offsite_employee_hardware": 0,
		"cloud_services": 0,
		"saas": 0,
		"managed_services": 0
	},
  "downstream_emissions": {
    "end_user_devices": 0,
    "network_data_transfer": 0
  }
}